{
  "id": "477033835",
  "url": "https://issues.chromium.org/issues/477033835",
  "title": "PDFium  heap-buffer-overflow at opj_j2k_read_sod",
  "status": "Assigned",
  "severity": "S3-Low",
  "priority": "P1",
  "component": "PDFium",
  "os_platforms": [
    "Linux",
    "Mac",
    "Windows",
    "ChromeOS"
  ],
  "chrome_version": null,
  "cve_ids": [],
  "reporter": "ke...@gmail.com",
  "assignee": "ts...@chromium.org",
  "created_date": "2026-01-19T21:15:03+00:00",
  "modified_date": "2026-05-14T07:56:45+00:00",
  "bounty_confirmed": true,
  "bounty_amount": 11000.0,
  "bounty_rationale": "Renderer RCE / memory corruption in a sandboxed process",
  "attachments": [
    {
      "id": 72628329,
      "filename": "test2n.j2k.pdf",
      "mime_type": "application/pdf",
      "size_bytes": 1140,
      "url": "https://issues.chromium.org/action/issues/477033835/attachments/72628329?download=true",
      "local_path": "attachments/test2n.j2k.pdf"
    }
  ],
  "update_count": 75,
  "description_snippet": "VULNERABILITY DETAILS\n\nA heap buffer overflow vulnerability exists in OpenJPEG's TLM (Tile Length Marker) decoding functionality. The vulnerability allows an attacker to write out-of-bounds to heap memory when processing a specially crafted JPEG 2000 file. The root cause is a missing bounds check i"
}