{
  "id": "474763968",
  "url": "https://issues.chromium.org/issues/474763968",
  "title": "ClipboardHost custom format methods bypass IsClipboardPasteAllowed (Issue 40051481 incomplete)",
  "status": "Assigned",
  "severity": "S3-Low",
  "priority": "P3",
  "component": "Blink>DataTransfer",
  "os_platforms": [
    "Android",
    "Linux",
    "Mac",
    "Windows",
    "ChromeOS"
  ],
  "chrome_version": "145.0.7626.0",
  "cve_ids": [],
  "reporter": "vi...@gmail.com",
  "assignee": "ro...@microsoft.com",
  "created_date": "2026-01-10T18:54:55+00:00",
  "modified_date": "2026-05-04T07:52:35+00:00",
  "bounty_confirmed": true,
  "bounty_amount": 2000.0,
  "bounty_rationale": "Low impact web privilege escalation + bisect",
  "attachments": [
    {
      "id": 72374748,
      "filename": "poc.html",
      "mime_type": "text/html",
      "size_bytes": 3676,
      "url": "https://issues.chromium.org/action/issues/474763968/attachments/72374748?download=true",
      "local_path": "attachments/poc.html"
    },
    {
      "id": 72374749,
      "filename": "victim.html",
      "mime_type": "text/html",
      "size_bytes": 1155,
      "url": "https://issues.chromium.org/action/issues/474763968/attachments/72374749?download=true",
      "local_path": "attachments/victim.html"
    },
    {
      "id": 72417515,
      "filename": "deleted",
      "mime_type": "application/octet-stream",
      "size_bytes": 0,
      "url": "https://issues.chromium.org/action/issues/474763968/attachments/72417515?download=true",
      "local_path": null
    },
    {
      "id": 72417519,
      "filename": "Screen Recording 2026-01-13 at 4.08.34 PM.mov",
      "mime_type": "video/quicktime",
      "size_bytes": 9669432,
      "url": "https://issues.chromium.org/action/issues/474763968/attachments/72417519?download=true",
      "local_path": null
    }
  ],
  "update_count": 45,
  "description_snippet": "# Steps to reproduce the problem\nSTEPS TO REPRODUCE:\n\n1. Build Chromium content_shell\n2. Start HTTP server from the Release directory:\n   cd [chromium_src]/out/Release\n   python -m http.server 8888\n\n3. Copy the attached PoC files (poc.html, victim.html) to the Release directory\n4. Open victim.html i"
}