{
  "id": "473851441",
  "url": "https://issues.chromium.org/issues/473851441",
  "title": "Data race in Map::bit_field2 access",
  "status": "Assigned",
  "severity": "S3-Low",
  "priority": "P1",
  "component": "Blink>JavaScript>Runtime",
  "os_platforms": [
    "Android",
    "Fuchsia",
    "Linux",
    "Mac",
    "Windows",
    "ChromeOS"
  ],
  "chrome_version": null,
  "cve_ids": [],
  "reporter": "p1...@gmail.com",
  "assignee": "ol...@chromium.org",
  "created_date": "2026-01-07T00:25:54+00:00",
  "modified_date": "2026-04-21T07:57:28+00:00",
  "bounty_confirmed": true,
  "bounty_amount": 7000.0,
  "bounty_rationale": null,
  "attachments": [
    {
      "id": 72268333,
      "filename": "poc.js",
      "mime_type": "text/javascript",
      "size_bytes": 515,
      "url": "https://issues.chromium.org/action/issues/473851441/attachments/72268333?download=true",
      "local_path": "attachments/poc.js"
    }
  ],
  "update_count": 94,
  "description_snippet": "## Summary\n\nA data race vulnerability exists in V8's Map object where concurrent access to `bit_field2` (which contains `elements_kind`) between the main thread and Maglev/TurboFan background compilation threads can lead to memory corruption. The race occurs because `bit_field2` is accessed with non"
}